----------------------------------------------------------------------------
CrystalDiskInfo 8.2.0 (C) 2008-2019 hiyohiyo
                                Crystal Dew World : https://crystalmark.info/
----------------------------------------------------------------------------

    OS : Windows 10 Professional [10.0 Build 18362] (x64)
  Date : 2019/09/30 17:51:40

-- Controller Map ----------------------------------------------------------
 + Standard SATA AHCI Controller [ATA]
   - Samsung SSD 850 EVO 250GB
 - Microsoft Storage Spaces Controller [SCSI]
 + Standard NVM Express Controller [SCSI]
   - WDC WDS512G1X0C-00ENX0
 - Microsoft VHD Loopback Controller [SCSI]

-- Disk List ---------------------------------------------------------------
 (1) Samsung SSD 850 EVO 250GB : 250.0 GB [0/0/0, pd1] - sg
 (2) WDC WDS512G1X0C-00ENX0 : 512.1 GB [1/1/0, sq] - nv

----------------------------------------------------------------------------
 (1) Samsung SSD 850 EVO 250GB
----------------------------------------------------------------------------
           Model : Samsung SSD 850 EVO 250GB
        Firmware : EMT03B6Q
   Serial Number : S3PZNF0J832298D
       Disk Size : 250.0 GB (8.4/137.4/250.0/250.0)
     Buffer Size : Unknown
     Queue Depth : 32
    # of Sectors : 488397168
   Rotation Rate : ---- (SSD)
       Interface : Serial ATA
   Major Version : ACS-2
   Minor Version : ATA8-ACS version 4c
   Transfer Mode : SATA/600 | SATA/600
  Power On Hours : 2596 hours
  Power On Count : 328 count
     Host Writes : 1182 GB
Wear Level Count : 4
     Temperature : 36 C (96 F)
   Health Status : Good (100 %)
        Features : S.M.A.R.T., 48bit LBA, NCQ, TRIM, DevSleep
       APM Level : ----
       AAM Level : ----
    Drive Letter : D:

-- S.M.A.R.T. --------------------------------------------------------------
ID Cur Wor Thr RawValues(6) Attribute Name
05 100 100 _10 000000000000 Reallocated Sector Count
09 _99 _99 __0 000000000A24 Power-on Hours
0C _99 _99 __0 000000000148 Power-on Count
B1 _99 _99 __0 000000000004 Wear Leveling Count
B3 100 100 _10 000000000000 Used Reserved Block Count (Total)
B5 100 100 _10 000000000000 Program Fail Count (Total)
B6 100 100 _10 000000000000 Erase Fail Count (Total)
B7 100 100 _10 000000000000 Runtime Bad Block (Total)
BB 100 100 __0 000000000000 Uncorrectable Error Count
BE _64 _52 __0 000000000024 Airflow Temperature
C3 200 200 __0 000000000000 ECC Error Rate
C7 100 100 __0 000000000000 CRC Error Count
EB _99 _99 __0 000000000054 POR Recovery Count
F1 _99 _99 __0 000093DDBD0A Total LBAs Written

-- IDENTIFY_DEVICE ---------------------------------------------------------
        0    1    2    3    4    5    6    7    8    9
000: 0040 3FFF C837 0010 0000 0000 003F 0000 0000 0000
010: 5333 505A 4E46 304A 3833 3232 3938 4420 2020 2020
020: 0000 0000 0000 454D 5430 3342 3651 5361 6D73 756E
030: 6720 5353 4420 3835 3020 4556 4F20 3235 3047 4220
040: 2020 2020 2020 2020 2020 2020 2020 8001 4001 2F00
050: 4000 0200 0200 0007 3FFF 0010 003F FC10 00FB 0101
060: FFFF 0FFF 0000 0007 0003 0078 0078 0078 0078 0F10
070: 0000 0000 0000 0000 0000 001F 850E 00C6 016C 0060
080: 03FC 0039 746B 7D01 4163 7469 BC01 4163 407F 0001
090: 0004 0000 FFFE 0000 0000 0000 0000 0000 0000 0000
100: 5970 1D1C 0000 0000 0000 0008 4000 0000 5002 538D
110: 4226 01B5 0000 0000 0000 0000 0000 0000 0000 401E
120: 401C 0000 0000 0000 0000 0000 0000 0000 0029 0000
130: 0000 0000 0000 0000 0000 0000 0000 0000 0000 0000
140: 0000 0000 0000 0000 0000 0000 0000 0000 0000 0000
150: 0000 0000 0000 0000 0000 0000 0000 0000 0000 0000
160: 0000 0000 0000 0000 0000 0000 0000 0000 0003 0001
170: 2020 2020 2020 2020 0000 0000 0000 0000 0000 0000
180: 0000 0000 0000 0000 0000 0000 0000 0000 0000 0000
190: 0000 0000 0000 0000 0000 0000 0000 0000 0000 0000
200: 0000 0000 0000 0000 0000 0000 003D 0000 0000 4000
210: 0000 0000 0000 0000 0000 0000 0000 0001 0000 0000
220: 0000 0000 107F 0000 0000 0000 0000 0000 0000 0000
230: 0000 0000 0000 0000 0000 0800 0000 0000 0000 0000
240: 0000 0000 0000 4000 0000 0000 0000 0000 0000 0000
250: 0000 0000 0000 0000 0000 12A5

-- SMART_READ_DATA ---------------------------------------------------------
     +0 +1 +2 +3 +4 +5 +6 +7 +8 +9 +A +B +C +D +E +F
000: 01 00 05 33 00 64 64 00 00 00 00 00 00 00 09 32
010: 00 63 63 24 0A 00 00 00 00 00 0C 32 00 63 63 48
020: 01 00 00 00 00 00 B1 13 00 63 63 04 00 00 00 00
030: 00 00 B3 13 00 64 64 00 00 00 00 00 00 00 B5 32
040: 00 64 64 00 00 00 00 00 00 00 B6 32 00 64 64 00
050: 00 00 00 00 00 00 B7 13 00 64 64 00 00 00 00 00
060: 00 00 BB 32 00 64 64 00 00 00 00 00 00 00 BE 32
070: 00 40 34 24 00 00 00 00 00 00 C3 1A 00 C8 C8 00
080: 00 00 00 00 00 00 C7 3E 00 64 64 00 00 00 00 00
090: 00 00 EB 12 00 63 63 54 00 00 00 00 00 00 F1 32
0A0: 00 63 63 0A BD DD 93 00 00 00 00 00 00 00 00 00
0B0: 00 00 00 00 00 00 00 00 00 00 00 00 00 00 00 00
0C0: 00 00 00 00 00 00 00 00 00 00 00 00 00 00 00 00
0D0: 00 00 00 00 00 00 00 00 00 00 00 00 00 00 00 00
0E0: 00 00 00 00 00 00 00 00 00 00 00 00 00 00 00 00
0F0: 00 00 00 00 00 00 00 00 00 00 00 00 00 00 00 00
100: 00 00 00 00 00 00 00 00 00 00 00 00 00 00 00 00
110: 00 00 00 00 00 00 00 00 00 00 00 00 00 00 00 00
120: 00 00 00 00 00 00 00 00 00 00 00 00 00 00 00 00
130: 00 00 00 00 00 00 00 00 00 00 00 00 00 00 00 00
140: 00 00 00 00 00 00 00 00 00 00 00 00 00 00 00 00
150: 00 00 00 00 00 00 00 00 00 00 00 00 00 00 00 00
160: 00 00 00 00 00 00 00 00 00 00 00 00 00 00 00 53
170: 03 00 01 00 02 85 00 00 00 00 00 00 00 00 00 00
180: 00 00 00 00 00 00 00 00 00 00 00 00 00 00 00 00
190: 00 00 00 00 00 00 00 00 00 00 00 00 00 00 00 00
1A0: 00 00 00 00 00 00 00 00 00 00 00 00 00 00 00 00
1B0: 00 00 00 00 00 00 00 00 00 00 00 00 00 00 00 00
1C0: 00 00 00 00 00 00 00 00 00 00 00 00 00 00 00 00
1D0: 00 00 00 00 00 00 00 00 00 00 00 00 00 00 00 00
1E0: 00 00 00 00 00 00 00 00 00 00 00 00 00 00 00 00
1F0: 00 00 00 00 00 00 00 00 00 00 00 00 00 00 00 EA

-- SMART_READ_THRESHOLD ----------------------------------------------------
     +0 +1 +2 +3 +4 +5 +6 +7 +8 +9 +A +B +C +D +E +F
000: 01 00 05 0A 00 00 00 00 00 00 00 00 00 00 09 00
010: 00 00 00 00 00 00 00 00 00 00 0C 00 00 00 00 00
020: 00 00 00 00 00 00 B1 00 00 00 00 00 00 00 00 00
030: 00 00 B3 0A 00 00 00 00 00 00 00 00 00 00 B5 0A
040: 00 00 00 00 00 00 00 00 00 00 B6 0A 00 00 00 00
050: 00 00 00 00 00 00 B7 0A 00 00 00 00 00 00 00 00
060: 00 00 BB 00 00 00 00 00 00 00 00 00 00 00 BE 00
070: 00 00 00 00 00 00 00 00 00 00 C3 00 00 00 00 00
080: 00 00 00 00 00 00 C7 00 00 00 00 00 00 00 00 00
090: 00 00 EB 00 00 00 00 00 00 00 00 00 00 00 F1 00
0A0: 00 00 00 00 00 00 00 00 00 00 00 00 00 00 00 00
0B0: 00 00 00 00 00 00 00 00 00 00 00 00 00 00 00 00
0C0: 00 00 00 00 00 00 00 00 00 00 00 00 00 00 00 00
0D0: 00 00 00 00 00 00 00 00 00 00 00 00 00 00 00 00
0E0: 00 00 00 00 00 00 00 00 00 00 00 00 00 00 00 00
0F0: 00 00 00 00 00 00 00 00 00 00 00 00 00 00 00 00
100: 00 00 00 00 00 00 00 00 00 00 00 00 00 00 00 00
110: 00 00 00 00 00 00 00 00 00 00 00 00 00 00 00 00
120: 00 00 00 00 00 00 00 00 00 00 00 00 00 00 00 00
130: 00 00 00 00 00 00 00 00 00 00 00 00 00 00 00 00
140: 00 00 00 00 00 00 00 00 00 00 00 00 00 00 00 00
150: 00 00 00 00 00 00 00 00 00 00 00 00 00 00 00 00
160: 00 00 00 00 00 00 00 00 00 00 00 00 00 00 00 00
170: 00 00 00 00 00 00 00 00 00 00 00 00 00 00 00 00
180: 00 00 00 00 00 00 00 00 00 00 00 00 00 00 00 00
190: 00 00 00 00 00 00 00 00 00 00 00 00 00 00 00 00
1A0: 00 00 00 00 00 00 00 00 00 00 00 00 00 00 00 00
1B0: 00 00 00 00 00 00 00 00 00 00 00 00 00 00 00 00
1C0: 00 00 00 00 00 00 00 00 00 00 00 00 00 00 00 00
1D0: 00 00 00 00 00 00 00 00 00 00 00 00 00 00 00 00
1E0: 00 00 00 00 00 00 00 00 00 00 00 00 00 00 00 00
1F0: 00 00 00 00 00 00 00 00 00 00 00 00 00 00 00 4E

----------------------------------------------------------------------------
 (2) WDC WDS512G1X0C-00ENX0
----------------------------------------------------------------------------
           Model : WDC WDS512G1X0C-00ENX0
        Firmware : B35500WD
   Serial Number : 171507420764
       Disk Size : 512.1 GB
     Buffer Size : Unknown
    # of Sectors : 
   Rotation Rate : ---- (SSD)
       Interface : NVM Express
   Major Version : NVM Express 1.2
   Minor Version : 
   Transfer Mode : PCIe 3.0 x2 | PCIe 3.0 x4
  Power On Hours : 14078 hours
  Power On Count : 107 count
      Host Reads : 11135 GB
     Host Writes : 10882 GB
     Temperature : 48 C (118 F)
   Health Status : Good (100 %)
        Features : S.M.A.R.T.
       APM Level : ----
       AAM Level : ----
    Drive Letter : C:

-- S.M.A.R.T. --------------------------------------------------------------
ID RawValues(6) Attribute Name
01 000000000000 Critical Warning
02 000000000141 Composite Temperature
03 000000000064 Available Spare
04 000000000004 Available Spare Threshold
05 000000000003 Percentage Used
06 0000015BFC6B Data Units Read
07 00000154170E Data Units Written
08 00000D7C29C4 Host Read Commands
09 000007EFC9F0 Host Write Commands
0A 000000005593 Controller Busy Time
0B 00000000006B Power Cycles
0C 0000000036FE Power On Hours
0D 000000000025 Unsafe Shutdowns
0E 000000000000 Media and Data Integrity Errors
0F 000000000001 Number of Error Information Log Entries

-- IDENTIFY_DEVICE ---------------------------------------------------------
        0    1    2    3    4    5    6    7    8    9
000: 15B7 1B4B 3731 3531 3730 3234 3730 3436 2020 2020
010: 2020 2020 4457 2043 4457 3553 3231 3147 3058 2D43
020: 3030 4E45 3058 2020 2020 2020 2020 2020 2020 2020
030: 2020 2020 3342 3535 3030 4457 4402 001B 0500 0000
040: 0200 0001 82B8 0001 4240 000F 0000 0000 0000 0000
050: 0000 0000 0000 0000 0000 0000 0000 0000 0000 0000
060: 0000 0000 0000 0000 0000 0000 0000 0000 0000 0000
070: 0000 0000 0000 0000 0000 0000 0000 0000 0000 0000
080: 0000 0000 0000 0000 0000 0000 0000 0000 0000 0000
090: 0000 0000 0000 0000 0000 0000 0000 0000 0000 0000
100: 0000 0000 0000 0000 0000 0000 0000 0000 0000 0000
110: 0000 0000 0000 0000 0000 0000 0000 0000 0000 0000
120: 0000 0000 0000 0000 0000 0000 0000 0000 0017 0704
130: 0214 043F 0101 0166 0169 0032 0000 0000 0000 0000
140: 0000 0000 0000 0000 0000 0000 0000 0000 0000 0000
150: 0000 0000 0000 0000 0000 0000 0000 0000 000E 0000
160: 0000 0000 0000 0000 0000 0000 0000 0000 0000 0000
170: 0000 0000 0000 0000 0000 0000 0000 0000 0000 0000
180: 0000 0000 0000 0000 0000 0000 0000 0000 0000 0000
190: 0000 0000 0000 0000 0000 0000 0000 0000 0000 0000
200: 0000 0000 0000 0000 0000 0000 0000 0000 0000 0000
210: 0000 0000 0000 0000 0000 0000 0000 0000 0000 0000
220: 0000 0000 0000 0000 0000 0000 0000 0000 0000 0000
230: 0000 0000 0000 0000 0000 0000 0000 0000 0000 0000
240: 0000 0000 0000 0000 0000 0000 0000 0000 0000 0000
250: 0000 0000 0000 0000 0000 0000

-- SMART_NVME --------------------------------------------------------------
     +0 +1 +2 +3 +4 +5 +6 +7 +8 +9 +A +B +C +D +E +F
000: 00 41 01 64 04 03 00 00 00 00 00 00 00 00 00 00
010: 00 00 00 00 00 00 00 00 00 00 00 00 00 00 00 00
020: 78 FC 5B 01 00 00 00 00 00 00 00 00 00 00 00 00
030: 10 17 54 01 00 00 00 00 00 00 00 00 00 00 00 00
040: C5 2A 7C 0D 00 00 00 00 00 00 00 00 00 00 00 00
050: 1B CA EF 07 00 00 00 00 00 00 00 00 00 00 00 00
060: 93 55 00 00 00 00 00 00 00 00 00 00 00 00 00 00
070: 6B 00 00 00 00 00 00 00 00 00 00 00 00 00 00 00
080: FE 36 00 00 00 00 00 00 00 00 00 00 00 00 00 00
090: 25 00 00 00 00 00 00 00 00 00 00 00 00 00 00 00
0A0: 00 00 00 00 00 00 00 00 00 00 00 00 00 00 00 00
0B0: 01 00 00 00 00 00 00 00 00 00 00 00 00 00 00 00
0C0: 00 00 00 00 00 00 00 00 00 00 00 00 00 00 00 00
0D0: 00 00 00 00 00 00 00 00 00 00 00 00 00 00 00 00
0E0: 00 00 00 00 00 00 00 00 00 00 00 00 00 00 00 00
0F0: 00 00 00 00 00 00 00 00 00 00 00 00 00 00 00 00
100: 00 00 00 00 00 00 00 00 00 00 00 00 00 00 00 00
110: 00 00 00 00 00 00 00 00 00 00 00 00 00 00 00 00
120: 00 00 00 00 00 00 00 00 00 00 00 00 00 00 00 00
130: 00 00 00 00 00 00 00 00 00 00 00 00 00 00 00 00
140: 00 00 00 00 00 00 00 00 00 00 00 00 00 00 00 00
150: 00 00 00 00 00 00 00 00 00 00 00 00 00 00 00 00
160: 00 00 00 00 00 00 00 00 00 00 00 00 00 00 00 00
170: 00 00 00 00 00 00 00 00 00 00 00 00 00 00 00 00
180: 00 00 00 00 00 00 00 00 00 00 00 00 00 00 00 00
190: 00 00 00 00 00 00 00 00 00 00 00 00 00 00 00 00
1A0: 00 00 00 00 00 00 00 00 00 00 00 00 00 00 00 00
1B0: 00 00 00 00 00 00 00 00 00 00 00 00 00 00 00 00
1C0: 00 00 00 00 00 00 00 00 00 00 00 00 00 00 00 00
1D0: 00 00 00 00 00 00 00 00 00 00 00 00 00 00 00 00
1E0: 00 00 00 00 00 00 00 00 00 00 00 00 00 00 00 00
1F0: 00 00 00 00 00 00 00 00 00 00 00 00 00 00 00 00

